{
  "slug": "example-cell",
  "name": "示例组件",
  "summary": "复制这个文件到 components/<slug>/meta.json 并改内容",
  "category": "other",
  "tags": ["示例"],
  "author": "your-name",
  "repo": "https://github.com/you/cellium-example",
  "license": "MIT",
  "cover": "https://raw.githubusercontent.com/you/cellium-example/main/cover.png",
  "versions": [
    {
      "version": "1.0.0",
      "date": "2026-10-31",
      "changelog": "首个版本",
      "download": "https://github.com/you/cellium-example/releases/download/v1.0.0/example-cell.zip"
    }
  ]
}
